{
  "match_id": "M0009",
  "season": "2023",
  "format": "T20",
  "date": "2023-04-17",
  "venue": {
    "code": "RAJ01"
  },
  "teams": [
    {
      "code": "RAJ",
      "name": "Rajasthan Titans"
    },
    {
      "code": "DEL",
      "name": "Delhi Falcons"
    }
  ],
  "toss": {
    "winner": "RAJ",
    "decision": "Field"
  },
  "result": {
    "method": "Normal",
    "winner": "DEL",
    "margin": 18,
    "margin_type": "Runs",
    "man_of_match": "P0141"
  },
  "innings": [
    {
      "innings_no": 1,
      "batting_team": "DEL",
      "bowling_team": "RAJ",
      "runs": 172,
      "wickets": 6,
      "overs": 20.0,
      "extras": 10
    },
    {
      "innings_no": 2,
      "batting_team": "RAJ",
      "bowling_team": "DEL",
      "runs": 154,
      "wickets": 4,
      "overs": 20.0,
      "extras": 3
    }
  ]
}