{
  "match_id": "M0004",
  "season": "2023",
  "format": "T20",
  "date": "2023-04-07",
  "venue": {
    "code": "RAJ01"
  },
  "teams": [
    {
      "code": "RAJ",
      "name": "Rajasthan Titans"
    },
    {
      "code": "KOL",
      "name": "Kolkata Tigers"
    }
  ],
  "toss": {
    "winner": "RAJ",
    "decision": "Bat"
  },
  "result": {
    "method": "Normal",
    "winner": "KOL",
    "margin": 2,
    "margin_type": "Wickets",
    "man_of_match": "P0138"
  },
  "innings": [
    {
      "innings_no": 1,
      "batting_team": "RAJ",
      "bowling_team": "KOL",
      "runs": 153,
      "wickets": 10,
      "overs": 18.2,
      "extras": 5
    },
    {
      "innings_no": 2,
      "batting_team": "KOL",
      "bowling_team": "RAJ",
      "runs": 165,
      "wickets": 8,
      "overs": 20.0,
      "extras": 2
    }
  ]
}