{
  "match_id": "M0113",
  "season": "2025",
  "format": "T20",
  "date": "2025-06-04",
  "venue": {
    "code": "HYD01"
  },
  "teams": [
    {
      "code": "HYD",
      "name": "Hyderabad Hawks"
    },
    {
      "code": "KOL",
      "name": "Kolkata Tigers"
    }
  ],
  "toss": {
    "winner": "KOL",
    "decision": "Field"
  },
  "result": {
    "method": "Normal",
    "winner": "HYD",
    "margin": 2,
    "margin_type": "Runs",
    "man_of_match": "P0071"
  },
  "innings": [
    {
      "innings_no": 1,
      "batting_team": "HYD",
      "bowling_team": "KOL",
      "runs": 191,
      "wickets": 5,
      "overs": 20.0,
      "extras": 7
    },
    {
      "innings_no": 2,
      "batting_team": "KOL",
      "bowling_team": "HYD",
      "runs": 189,
      "wickets": 6,
      "overs": 20.0,
      "extras": 12
    }
  ]
}