{
  "match_id": "M0066",
  "season": "2024",
  "format": "T20",
  "date": "2024-05-21",
  "venue": {
    "code": "RAJ01"
  },
  "teams": [
    {
      "code": "RAJ",
      "name": "Rajasthan Titans"
    },
    {
      "code": "CHE",
      "name": "Chennai Kings"
    }
  ],
  "toss": {
    "winner": "RAJ",
    "decision": "Bat"
  },
  "result": {
    "method": "NoResult",
    "winner": null,
    "margin": null,
    "margin_type": null,
    "man_of_match": null
  },
  "innings": [
    {
      "innings_no": 1,
      "batting_team": "RAJ",
      "bowling_team": "CHE",
      "runs": 199,
      "wickets": 9,
      "overs": 20.0,
      "extras": 7
    }
  ]
}