{
  "match_id": "M0085",
  "season": "2025",
  "format": "T20",
  "date": "2025-04-09",
  "venue": {
    "code": "MUM01"
  },
  "teams": [
    {
      "code": "MUM",
      "name": "Mumbai Sharks"
    },
    {
      "code": "PUN",
      "name": "Punjab Warriors"
    }
  ],
  "toss": {
    "winner": "MUM",
    "decision": "Field"
  },
  "result": {
    "method": "Normal",
    "winner": "PUN",
    "margin": 10,
    "margin_type": "Runs",
    "man_of_match": "P0115"
  },
  "innings": [
    {
      "innings_no": 1,
      "batting_team": "PUN",
      "bowling_team": "MUM",
      "runs": 142,
      "wickets": 10,
      "overs": 17.4,
      "extras": 2
    },
    {
      "innings_no": 2,
      "batting_team": "MUM",
      "bowling_team": "PUN",
      "runs": 132,
      "wickets": 10,
      "overs": 17.2,
      "extras": 7
    }
  ]
}