{
  "match_id": "M0060",
  "season": "2024",
  "format": "T20",
  "date": "2024-05-09",
  "venue": {
    "code": "MUM01"
  },
  "teams": [
    {
      "code": "MUM",
      "name": "Mumbai Sharks"
    },
    {
      "code": "BLR",
      "name": "Bangalore Royals"
    }
  ],
  "toss": {
    "winner": "MUM",
    "decision": "Bat"
  },
  "result": {
    "method": "Normal",
    "winner": "BLR",
    "margin": 5,
    "margin_type": "Wickets",
    "man_of_match": "P0010"
  },
  "innings": [
    {
      "innings_no": 1,
      "batting_team": "MUM",
      "bowling_team": "BLR",
      "runs": 148,
      "wickets": 8,
      "overs": 20.0,
      "extras": 4
    },
    {
      "innings_no": 2,
      "batting_team": "BLR",
      "bowling_team": "MUM",
      "runs": 173,
      "wickets": 5,
      "overs": 20.0,
      "extras": 5
    }
  ]
}