{
  "match_id": "M0067",
  "season": "2024",
  "format": "T20",
  "date": "2024-05-23",
  "venue": {
    "code": "MUM01"
  },
  "teams": [
    {
      "code": "MUM",
      "name": "Mumbai Sharks"
    },
    {
      "code": "CHE",
      "name": "Chennai Kings"
    }
  ],
  "toss": {
    "winner": "CHE",
    "decision": "Field"
  },
  "result": {
    "method": "Normal",
    "winner": "CHE",
    "margin": 3,
    "margin_type": "Wickets",
    "man_of_match": "P0007"
  },
  "innings": [
    {
      "innings_no": 1,
      "batting_team": "MUM",
      "bowling_team": "CHE",
      "runs": 150,
      "wickets": 10,
      "overs": 15.1,
      "extras": 8
    },
    {
      "innings_no": 2,
      "batting_team": "CHE",
      "bowling_team": "MUM",
      "runs": 200,
      "wickets": 7,
      "overs": 20.0,
      "extras": 10
    }
  ]
}