{
  "match_id": "M0053",
  "season": "2024",
  "format": "T20",
  "date": "2024-04-25",
  "venue": {
    "code": "KOL01"
  },
  "teams": [
    {
      "code": "KOL",
      "name": "Kolkata Tigers"
    },
    {
      "code": "DEL",
      "name": "Delhi Comets"
    }
  ],
  "toss": {
    "winner": "KOL",
    "decision": "Bat"
  },
  "result": {
    "method": "Normal",
    "winner": "DEL",
    "margin": 2,
    "margin_type": "Wickets",
    "man_of_match": "P0026"
  },
  "innings": [
    {
      "innings_no": 1,
      "batting_team": "KOL",
      "bowling_team": "DEL",
      "runs": 192,
      "wickets": 10,
      "overs": 19.2,
      "extras": 8
    },
    {
      "innings_no": 2,
      "batting_team": "DEL",
      "bowling_team": "KOL",
      "runs": 204,
      "wickets": 8,
      "overs": 20.0,
      "extras": 6
    }
  ]
}