{
  "match_id": "M0077",
  "season": "2024",
  "format": "T20",
  "date": "2024-06-12",
  "venue": {
    "code": "CHE01"
  },
  "teams": [
    {
      "code": "CHE",
      "name": "Chennai Kings"
    },
    {
      "code": "BLR",
      "name": "Bangalore Royals"
    }
  ],
  "toss": {
    "winner": "BLR",
    "decision": "Bat"
  },
  "result": {
    "method": "Normal",
    "winner": "BLR",
    "margin": 28,
    "margin_type": "Runs",
    "man_of_match": "P0039"
  },
  "innings": [
    {
      "innings_no": 1,
      "batting_team": "BLR",
      "bowling_team": "CHE",
      "runs": 189,
      "wickets": 7,
      "overs": 20.0,
      "extras": 11
    },
    {
      "innings_no": 2,
      "batting_team": "CHE",
      "bowling_team": "BLR",
      "runs": 161,
      "wickets": 10,
      "overs": 18.3,
      "extras": 11
    }
  ]
}