{
  "match_id": "M0034",
  "season": "2023",
  "format": "T20",
  "date": "2023-06-06",
  "venue": {
    "code": "BLR01"
  },
  "teams": [
    {
      "code": "BLR",
      "name": "Bangalore Royals"
    },
    {
      "code": "RAJ",
      "name": "Rajasthan Titans"
    }
  ],
  "toss": {
    "winner": "BLR",
    "decision": "Field"
  },
  "result": {
    "method": "Normal",
    "winner": "RAJ",
    "margin": 9,
    "margin_type": "Runs",
    "man_of_match": "P0089"
  },
  "innings": [
    {
      "innings_no": 1,
      "batting_team": "RAJ",
      "bowling_team": "BLR",
      "runs": 183,
      "wickets": 9,
      "overs": 20.0,
      "extras": 9
    },
    {
      "innings_no": 2,
      "batting_team": "BLR",
      "bowling_team": "RAJ",
      "runs": 174,
      "wickets": 6,
      "overs": 20.0,
      "extras": 8
    }
  ]
}